author,publisher,isbn,quantity,title,description,genre,price
John Doe,Wholehouse,10928901,7,Generic Title,Description,Generic Genre,20.7
Francis Scott Fitzgerald,Charles Scribner's Sons,9780333791035,10,The Great Gatsby,"Set in the Jazz Age on Long Island, near New York City, the novel depicts first-person narrator Nick Carraway's interactions with mysterious millionaire Jay Gatsby and Gatsby's obsession to reunite with his former lover, Daisy Buchanan",Tragedy, 17.9
Herman Melville,Knopf Doubleday Publishing Group,9780553213119,3,Moby Dick,"The book is the sailor Ishmael's narrative of the obsessive quest of Ahab, captain of the whaling ship Pequod, for revenge on Moby Dick, the giant white sperm whale that on the ship's previous voyage bit off Ahab's leg at the knee.",Fiction,15.2
Fyodor Dostoyevsky,The Russian Messenger,9780198709701,5,Crime and Punishment,"It is a murder story, told from a murder;s point of view, that implicates even the most innocent reader in its enormities. It is a cat-and-mouse game between a tormented young killer and a cheerfully implacable detective. It is a preternaturally acute investigation of the forces that impel a man toward sin, suffering, and grace. Ever since its publication in 1866 Crime and Punishment has intrigued readers and sorely tested translators, the best of whom seemed to capture one facet of Dostoevsky's masterpiece while missing the rest.",Crime Fiction,30.8
Rebecca Serle,Atria Books,9781982166793,6,One Italian Summer,"When Katy’s mother dies, she is left reeling. Carol wasn’t just Katy’s mom, but her best friend and first phone call. She had all the answers and now, when Katy needs her the most, she is gone.",Fiction,22.9
Alexis Hall,Sourcebooks,9781728206141,2,Boyfriend Material,"Luc O'Donnell is tangentially—and reluctantly—famous. His rock star parents split when he was young, and the father he's never met spent the next twenty years cruising in and out of rehab. Now that his dad's making a comeback, Luc's back in the public eye, and one compromising photo is enough to ruin everything.",Romance,23.8
Randy Rainbow,St. Martin's Publishing Group,9781250276254,23,Playing With Myself,"Randy Rainbow, the man who conquered the Internet with a stylish pair of pink glasses, an inexhaustible knowledge of Broadway musicals, and the most gimlet-eyed view of American politics this side of Mark Twain finally tells all in Playing with Myself, a memoir sure to cause more than a few readers to begin singing one of his greatest hits like “A Spoonful of Clorox” or “Cover Your Freakin’ Face.”",Biography,12.3
